{
  "repository": "jmirving/Nexus",
  "defaultBranch": "main",
  "defaultConcurrency": 2,
  "capabilities": {
    "node": { "preflight": "node --version" },
    "playwright": { "preflight": "npm run test:e2e:install" },
    "postgres": { "preflight": "docker info && npm run verify:ci-postgres" },
    "external_research": { "required": true }
  },
  "integration": {
    "enabled": false,
    "commands": ["npm run verify"],
    "postMergeCommands": [],
    "closeIssues": false
  },
  "work": {
    "31": {
      "status": "ready",
      "mode": "research",
      "requires": ["external_research"],
      "humanGate": "live provider enablement"
    },
    "34": { "status": "ready", "requires": ["node", "playwright"] },
    "47": { "status": "ready", "requires": ["node", "postgres", "playwright"] },
    "56": { "status": "ready", "requires": ["node"] },
    "57": { "status": "ready", "requires": ["node", "postgres", "playwright"] },
    "59": { "status": "ready", "requires": ["node", "postgres", "playwright"] },
    "33": { "status": "ready", "blockedBy": ["31"], "requires": ["node", "postgres", "playwright"] },
    "46": { "status": "ready", "blockedBy": ["47"], "requires": ["node", "playwright"] },
    "58": { "status": "ready", "blockedBy": ["57"], "requires": ["node", "playwright"] },
    "60": { "status": "ready", "blockedBy": ["57"], "requires": ["node", "postgres", "playwright"] },
    "19": { "status": "ready", "blockedBy": ["33", "57", "59"], "requires": ["node", "postgres", "playwright"] }
  }
}
